{
  "schema_version": "pdx_step_receipt_v1",
  "receipt_id": "g1a-receipt-render-draft",
  "run_id": "g1a-run-synthetic",
  "step_id": "render-artifact",
  "status": "failed",
  "attempt": 1,
  "request_digest": "aaaaaaaaaaaaaaaaaaaaaaaaaaaaaaaaaaaaaaaaaaaaaaaaaaaaaaaaaaaaaaaa",
  "input_digest": "bbbbbbbbbbbbbbbbbbbbbbbbbbbbbbbbbbbbbbbbbbbbbbbbbbbbbbbbbbbbbbbb",
  "error": {
    "code": "RENDERER_NOT_AVAILABLE",
    "message": "no renderer is available for this format yet",
    "retryable": false,
    "reconcile_required": false
  },
  "recorded_at": "2026-08-23T00:00:00Z"
}
